{
  "version": "0.1.0",
  "generated_at": "2026-02-17",
  "placeholders": [
    "{overall_grade}",
    "{overall_score}",
    "{location_grade}",
    "{location_score}",
    "{condition_grade}",
    "{condition_score}",
    "{cost_grade}",
    "{cost_score}",
    "{monthly_fixed_cost_yen}",
    "{initial_cost_total_yen}",
    "{initial_multiple}",
    "{rent_delta_ratio}",
    "{benchmark_confidence}",
    "{prefecture}",
    "{nearest_station_name}",
    "{station_walk_min}",
    "{layout_type}",
    "{area_sqm}",
    "{building_age_years}",
    "{orientation}",
    "{bathroom_toilet_separate}"
  ],
  "rules": [
    {
      "id": "R01_BENCHMARK_NONE",
      "priority": 900,
      "when": {
        "==": [
          { "var": "benchmark_confidence" },
          "none"
        ]
      },
      "summary_ko": "이 매물은 종합 {overall_grade}({overall_score})로 보이지만, 벤치마크 신뢰도({benchmark_confidence})가 사실상 없어서 비용/입지/컨디션 비교의 불확실성이 큽니다. 현재 점수({location_grade}/{condition_grade}/{cost_grade})를 기준으로 본인의 우선순위(출퇴근/주거쾌적/지출)를 먼저 정한 뒤, 동일 역·유사 조건 매물 3~5개와 월고정비·초기비용(IM)을 나란히 확인하는 접근이 안전합니다. 외국인 계약 관점에서는 초기비용(IM)을 1개월 정도 보수적으로 보고, 礼金은 1개월까지 허용범위로 가정한 뷰도 함께 확인해 리스크를 줄이세요.",
      "evidence_bullets_ko": [
        "월 고정비(임대료+관리비): {monthly_fixed_cost_yen} JPY",
        "초기비용 합계: {initial_cost_total_yen} JPY (IM={initial_multiple})",
        "월고정비 벤치마크 대비: rent_delta_ratio={rent_delta_ratio} (신뢰도={benchmark_confidence})",
        "역 도보 {station_walk_min}분 · 전용 {area_sqm}㎡ · 연식 {building_age_years}년 · 방위 {orientation} · 욕실분리 {bathroom_toilet_separate}"
      ],
      "negotiation_suggestions_ko": [
        "礼金(레이킨): 감액/0엔 가능 여부 문의(동일 단지/역세권 비교 매물 제시)",
        "仲介手数料(중개수수료): 상한(0.5개월/1개월) 및 할인/캠페인 적용 여부 확인",
        "鍵交換費用(열쇠교체): 필수 여부·금액 근거 확인 후 감액/면제 협의",
        "クリーニング費用(청소비): 퇴거 시 정산으로 전환/감액 가능 여부 협의",
        "フリーレント: 1개월 등 제공 가능 여부(초기비용 조정 대안으로) 문의"
      ],
      "negotiation_suggestions_ja": [
        "礼金：減額またはゼロにできないかご相談可能でしょうか（近隣の比較物件も確認しています）。",
        "仲介手数料：上限（月額賃料の0.5ヶ月/1ヶ月）と割引・キャンペーン適用可否をご確認いただけますか。",
        "鍵交換費用：必須かどうか、金額の根拠を確認のうえ減額・免除をご相談できますか。",
        "クリーニング費用：退去時精算への変更、または減額をご相談可能でしょうか。",
        "フリーレント：1ヶ月などの付与をご相談可能でしょうか（初期費用調整の代替案として）。"
      ],
      "alternative_search_queries_ja": [
        "{prefecture} {nearest_station_name} {layout_type} 賃貸",
        "{nearest_station_name} 徒歩{station_walk_min}分以内 {layout_type}",
        "{nearest_station_name} {layout_type} 礼金なし",
        "{nearest_station_name} {layout_type} 仲介手数料無料",
        "{nearest_station_name} {layout_type} 鍵交換なし",
        "{nearest_station_name} {layout_type} フリーレント",
        "{nearest_station_name} {layout_type} クリーニング費用なし",
        "{nearest_station_name} {layout_type} {area_sqm}㎡ 以上"
      ]
    },
    {
      "id": "R02_BENCHMARK_LOW",
      "priority": 850,
      "when": {
        "==": [
          { "var": "benchmark_confidence" },
          "low"
        ]
      },
      "summary_ko": "종합 {overall_grade}({overall_score})로 평가되지만, 벤치마크 신뢰도({benchmark_confidence})가 낮아 rent_delta_ratio={rent_delta_ratio} 해석 오차가 커질 수 있습니다. 따라서 점수는 참고로 두고, '월고정비 {monthly_fixed_cost_yen} + 초기비용(IM {initial_multiple})'의 현금흐름을 중심으로 {station_walk_min}분 도보/연식 {building_age_years}년/면적 {area_sqm}㎡ 같은 체감 요소와의 트레이드오프를 판단하는 편이 안전합니다. 외국인 계약은 초기비용(IM)을 1개월 정도 보수적으로, 礼金은 1개월까지 허용범위로 가정한 뷰도 같이 확인해 리스크를 줄이세요.",
      "evidence_bullets_ko": [
        "월 고정비: {monthly_fixed_cost_yen} JPY (임대료+관리비)",
        "초기비용: {initial_cost_total_yen} JPY, IM={initial_multiple}",
        "벤치마크 대비 월고정비 변화: rent_delta_ratio={rent_delta_ratio} (신뢰도={benchmark_confidence})",
        "입지/컨디션 체감 지표: 도보 {station_walk_min}분 · 연식 {building_age_years}년 · {area_sqm}㎡ · 방위 {orientation} · 욕실분리 {bathroom_toilet_separate}"
      ],
      "negotiation_suggestions_ko": [
        "礼金: 0.5~1개월 감액 또는 0엔 전환 가능 여부 문의",
        "仲介手数料: 할인/캠페인 적용, 또는 고정비(관리비 포함) 기준으로 재산정 가능 여부 확인",
        "鍵交換: 교체 생략/비용 상한 적용 가능 여부 협의",
        "クリーニング: 입주 전 비용 분리 청구 여부 확인 후 감액/퇴거 시 정산 전환 협의",
        "フリーレント: 0.5~1개월 제공 가능 여부(초기비용 보전 목적) 문의"
      ],
      "negotiation_suggestions_ja": [
        "礼金：0.5〜1ヶ月分の減額、またはゼロへの変更をご相談可能でしょうか。",
        "仲介手数料：割引・キャンペーン適用、または管理費込み賃料ベースでの再計算可否をご確認ください。",
        "鍵交換費用：交換省略、もしくは費用上限の適用をご相談できますか。",
        "クリーニング費用：内訳を確認のうえ、減額または退去時精算への変更をご相談可能でしょうか。",
        "フリーレント：0.5〜1ヶ月の付与をご相談可能でしょうか（初期費用の調整として）。"
      ],
      "alternative_search_queries_ja": [
        "{prefecture} {nearest_station_name} {layout_type} 賃貸",
        "{nearest_station_name} 徒歩{station_walk_min}分以内 {layout_type}",
        "{nearest_station_name} {layout_type} 礼金なし",
        "{nearest_station_name} {layout_type} 仲介手数料無料",
        "{nearest_station_name} {layout_type} フリーレント",
        "{nearest_station_name} {layout_type} 初期費用 安い",
        "{nearest_station_name} {layout_type} 築浅",
        "{nearest_station_name} {layout_type} {area_sqm}㎡"
      ]
    },
    {
      "id": "R03_CONDITION_HIGH_COST_LOW",
      "priority": 800,
      "when": {
        "and": [
          { ">=": [ { "var": "condition_score" }, 70 ] },
          { "<=": [ { "var": "cost_score" }, 40 ] }
        ]
      },
      "summary_ko": "컨디션은 {condition_grade}({condition_score})로 강점이지만, 비용 효율은 {cost_grade}({cost_score})로 아쉬운 편이라 '살기 편함'과 '지출(월고정비·초기비용)' 사이 트레이드오프가 핵심입니다. 월고정비 {monthly_fixed_cost_yen}와 초기비용(IM {initial_multiple}) 중 어느 쪽이 부담인지 먼저 정한 뒤, rent_delta_ratio={rent_delta_ratio}가 높게 나온 이유(월세/관리비/초기비용 구조)를 분해해서 협상 여지를 찾아보는 게 좋습니다. 외국인 계약은 초기비용(IM)을 1개월 정도 보수적으로, 礼金은 1개월까지 허용범위로 가정한 뷰도 함께 확인하세요.",
      "evidence_bullets_ko": [
        "컨디션: {condition_grade}({condition_score}) / 방위 {orientation}, 욕실분리 {bathroom_toilet_separate}",
        "비용: 월고정비 {monthly_fixed_cost_yen} JPY, 초기비용 {initial_cost_total_yen} JPY (IM {initial_multiple})",
        "벤치마크 대비: rent_delta_ratio={rent_delta_ratio} (신뢰도={benchmark_confidence})",
        "체감 요소: 역 도보 {station_walk_min}분 · {area_sqm}㎡ · 연식 {building_age_years}년"
      ],
      "negotiation_suggestions_ko": [
        "礼金: 0~1개월 감액/면제 가능 여부(컨디션 강점은 유지, 비용만 조정) 문의",
        "仲介手数料: 상한 적용 및 할인/쿠폰 여부 확인",
        "鍵交換: 필수/선택 여부 확인 후 감액 협의",
        "クリーニング: 금액 근거 확인 후 감액 또는 퇴거 시 정산 전환 협의",
        "フリーレント: 0.5~1개월 제공으로 월고정비 부담을 초기로 이동시키는 옵션 문의"
      ],
      "negotiation_suggestions_ja": [
        "礼金：0〜1ヶ月分の減額・免除をご相談可能でしょうか（条件は気に入っているので費用面を調整したいです）。",
        "仲介手数料：上限適用と割引の可否をご確認ください。",
        "鍵交換費用：必須/任意の確認のうえ、減額をご相談できますか。",
        "クリーニング費用：金額の根拠を確認のうえ、減額または退去時精算への変更をご相談可能でしょうか。",
        "フリーレント：0.5〜1ヶ月の付与をご相談可能でしょうか。"
      ],
      "alternative_search_queries_ja": [
        "{nearest_station_name} {layout_type} 築浅",
        "{nearest_station_name} {layout_type} バス・トイレ別",
        "{nearest_station_name} {layout_type} 南向き",
        "{nearest_station_name} 徒歩{station_walk_min}分以内 {layout_type} 築{building_age_years}年",
        "{nearest_station_name} {layout_type} 礼金なし",
        "{nearest_station_name} {layout_type} フリーレント",
        "{prefecture} {nearest_station_name} {layout_type} 初期費用 安い",
        "{nearest_station_name} {layout_type} {area_sqm}㎡"
      ]
    },
    {
      "id": "R04_LOCATION_HIGH_CONDITION_LOW",
      "priority": 750,
      "when": {
        "and": [
          { ">=": [ { "var": "location_score" }, 70 ] },
          { "<=": [ { "var": "condition_score" }, 40 ] }
        ]
      },
      "summary_ko": "입지는 {location_grade}({location_score})로 강하지만, 컨디션은 {condition_grade}({condition_score})로 타협이 필요한 케이스입니다. 즉, '{station_walk_min}분 도보/역 접근성'을 얻는 대신 '{building_age_years}년 연식·{area_sqm}㎡·방위/설비'에서 불편을 감수할 수 있는지가 핵심 트레이드오프입니다. 비용({monthly_fixed_cost_yen}, IM {initial_multiple}, rent_delta_ratio={rent_delta_ratio})은 협상으로 개선 여지가 생길 수 있으니, 외국인 계약 관점까지 포함해(초기비용 1개월 보수, 礼金 1개월 허용 가정) 조정 가능한 항목을 우선적으로 확인하세요.",
      "evidence_bullets_ko": [
        "입지: {location_grade}({location_score}), 역 도보 {station_walk_min}분 / {prefecture} {nearest_station_name}",
        "컨디션: {condition_grade}({condition_score}), 연식 {building_age_years}년 · {area_sqm}㎡ · 방위 {orientation} · 욕실분리 {bathroom_toilet_separate}",
        "월 고정비: {monthly_fixed_cost_yen} JPY / 초기비용 {initial_cost_total_yen} JPY (IM {initial_multiple})",
        "벤치마크 대비: rent_delta_ratio={rent_delta_ratio} (신뢰도={benchmark_confidence})"
      ],
      "negotiation_suggestions_ko": [
        "礼金: 연식/설비 타협을 근거로 감액/0엔 전환 협의",
        "仲介手数料: 할인 또는 상한 적용 요청(입지 선호로 수요가 높아도 요청은 가능)",
        "鍵交換: 교체비 상한/면제 가능 여부 확인",
        "クリーニング: 금액 조정 또는 퇴거 시 정산 전환 협의",
        "フリーレント: 0.5~1개월 제공으로 체감 비용 보전 가능 여부 문의"
      ],
      "negotiation_suggestions_ja": [
        "礼金：築年数や設備条件を踏まえて、減額またはゼロをご相談可能でしょうか。",
        "仲介手数料：割引、もしくは上限適用をご検討いただけますか。",
        "鍵交換費用：費用上限の適用または免除の可否をご確認ください。",
        "クリーニング費用：減額、または退去時精算への変更をご相談できますか。",
        "フリーレント：0.5〜1ヶ月の付与をご相談可能でしょうか。"
      ],
      "alternative_search_queries_ja": [
        "{nearest_station_name} 徒歩{station_walk_min}分以内 {layout_type}",
        "{nearest_station_name} {layout_type} バス・トイレ別",
        "{nearest_station_name} {layout_type} 築古",
        "{nearest_station_name} {layout_type} 家賃 安い",
        "{nearest_station_name} {layout_type} 礼金なし",
        "{nearest_station_name} {layout_type} フリーレント",
        "{prefecture} {nearest_station_name} {layout_type}",
        "{nearest_station_name} {layout_type} {area_sqm}㎡"
      ]
    },
    {
      "id": "R05_COST_HIGH_LOCATION_LOW",
      "priority": 700,
      "when": {
        "and": [
          { ">=": [ { "var": "cost_score" }, 70 ] },
          { "<=": [ { "var": "location_score" }, 40 ] }
        ]
      },
      "summary_ko": "비용은 {cost_grade}({cost_score})로 매력적이지만, 입지는 {location_grade}({location_score})로 약해 '저비용'과 '이동/생활 편의'의 트레이드오프가 뚜렷합니다. rent_delta_ratio={rent_delta_ratio}와 IM {initial_multiple}가 유리하게 나온 만큼, 실제 체감은 {station_walk_min}분 도보와 생활권(역 주변 상권/환승)을 감수할 수 있는지에 달려 있습니다. 외국인 계약은 초기비용을 1개월 보수적으로, 礼金 1개월 허용 가정으로 다시 계산해도 여전히 부담이 낮은지 확인하세요.",
      "evidence_bullets_ko": [
        "비용: 월고정비 {monthly_fixed_cost_yen} JPY / 초기비용 {initial_cost_total_yen} JPY (IM {initial_multiple})",